{
  "conflict_policy": "Item and spell pages win for acquisition details. Guide source cells are retained as evidence and used only when item-page data is missing.",
  "parser_version": "wowhead-scraper-0.10.0",
  "registry_notes": [
    "Gear BiS coverage is registered explicitly for every class/spec/phase unit. Shared Wowhead guide URLs are repeated when one guide backs multiple addon specs.",
    "Item, spell, gem, enchant, consumable, and leveling acquisition pages are discovered from registered guide snapshots and audited after snapshots exist.",
    "Non-gear guide URLs are explicitly registered per class/spec; class-wide guides intentionally repeat URLs across spec units."
  ],
  "snapshot_policy": "Commit normalized snapshots; retain phase-scoped historical Pre-Raid evidence when refreshing mutable URLs. Do not commit HTML caches.",
  "source_policy": "Wowhead TBC guide pages are canonical for rankings and context; Wowhead TBC item/spell pages are canonical for acquisition data; reviewed overrides are applied last.",
  "sources": [
    {
      "class": "Druid",
      "content_phases": [
        "PR",
        "T4",
        "T5",
        "T6",
        "ZA",
        "SWP"
      ],
      "content_terminology": "anniversary_2026",
      "data_family": "bis_lists",
      "fetched_at": null,
      "id": "bis-lists-druid-balance-pr",
      "inheritance_policy": "nearest_earlier_verified",
      "phase": "PR",
      "spec": "Balance",
      "status": "ready_full_bis",
      "type": "wowhead_guide",
      "url": "https://www.wowhead.com/tbc/guide/classes/druid/balance/dps-bis-gear-pve-pre-raid"
    },
    {
      "class": "Druid",
      "content_terminology": "wowhead_classic",
      "data_family": "bis_lists",
      "fetched_at": null,
      "id": "bis-lists-druid-balance-t4",
      "phase": "T4",
      "spec": "Balance",
      "status": "ready_full_bis",
      "type": "wowhead_guide",
      "url": "https://www.wowhead.com/tbc/guide/balance-druid-dps-karazhan-best-in-slot-gear-burning-crusade-classic-wow"
    },
    {
      "class": "Druid",
      "content_terminology": "anniversary_2026",
      "data_family": "bis_lists",
      "fetched_at": null,
      "id": "bis-lists-druid-balance-t5",
      "phase": "T5",
      "spec": "Balance",
      "status": "ready_full_bis",
      "type": "wowhead_guide",
      "url": "https://www.wowhead.com/tbc/guide/classes/druid/balance/dps-bis-gear-pve-phase-2"
    },
    {
      "class": "Druid",
      "content_terminology": "wowhead_classic",
      "data_family": "bis_lists",
      "fetched_at": null,
      "id": "bis-lists-druid-balance-t6",
      "phase": "T6",
      "spec": "Balance",
      "status": "ready_full_bis",
      "type": "wowhead_guide",
      "url": "https://www.wowhead.com/tbc/guide/balance-druid-dps-bt-hyjal-phase-3-best-in-slot-gear-burning-crusade"
    },
    {
      "class": "Druid",
      "content_terminology": "wowhead_classic",
      "data_family": "bis_lists",
      "fetched_at": null,
      "id": "bis-lists-druid-balance-za",
      "phase": "ZA",
      "spec": "Balance",
      "status": "ready_full_bis",
      "type": "wowhead_guide",
      "url": "https://www.wowhead.com/tbc/guide/balance-druid-dps-za-phase-4-best-in-slot-gear-burning-crusade"
    },
    {
      "class": "Druid",
      "content_terminology": "wowhead_classic",
      "data_family": "bis_lists",
      "fetched_at": null,
      "id": "bis-lists-druid-balance-swp",
      "phase": "SWP",
      "spec": "Balance",
      "status": "ready_full_bis",
      "type": "wowhead_guide",
      "url": "https://www.wowhead.com/tbc/guide/balance-druid-dps-swp-phase-5-best-in-slot-gear-burning-crusade"
    },
    {
      "class": "Druid",
      "content_phases": [
        "PR",
        "T4",
        "T5",
        "T6",
        "ZA",
        "SWP"
      ],
      "content_terminology": "anniversary_2026",
      "data_family": "bis_lists",
      "fetched_at": null,
      "id": "bis-lists-druid-feral-tank-pr",
      "inheritance_policy": "nearest_earlier_verified",
      "phase": "PR",
      "spec": "Feral tank",
      "status": "ready_full_bis",
      "type": "wowhead_guide",
      "url": "https://www.wowhead.com/tbc/guide/classes/druid/feral/tank-bis-gear-pve-pre-raid"
    },
    {
      "class": "Druid",
      "content_terminology": "wowhead_classic",
      "data_family": "bis_lists",
      "fetched_at": null,
      "id": "bis-lists-druid-feral-tank-t4",
      "phase": "T4",
      "spec": "Feral tank",
      "status": "ready_full_bis",
      "type": "wowhead_guide",
      "url": "https://www.wowhead.com/tbc/guide/feral-druid-tank-karazhan-best-in-slot-gear-burning-crusade-classic-wow"
    },
    {
      "class": "Druid",
      "content_terminology": "anniversary_2026",
      "data_family": "bis_lists",
      "fetched_at": null,
      "id": "bis-lists-druid-feral-tank-t5",
      "phase": "T5",
      "spec": "Feral tank",
      "status": "ready_full_bis",
      "type": "wowhead_guide",
      "url": "https://www.wowhead.com/tbc/guide/classes/druid/feral/tank-bis-gear-pve-phase-2"
    },
    {
      "class": "Druid",
      "content_terminology": "wowhead_classic",
      "data_family": "bis_lists",
      "fetched_at": null,
      "id": "bis-lists-druid-feral-tank-t6",
      "phase": "T6",
      "spec": "Feral tank",
      "status": "ready_full_bis",
      "type": "wowhead_guide",
      "url": "https://www.wowhead.com/tbc/guide/feral-druid-tank-bt-hyjal-phase-3-best-in-slot-gear-burning-crusade"
    },
    {
      "class": "Druid",
      "content_terminology": "wowhead_classic",
      "data_family": "bis_lists",
      "fetched_at": null,
      "id": "bis-lists-druid-feral-tank-za",
      "phase": "ZA",
      "spec": "Feral tank",
      "status": "ready_full_bis",
      "type": "wowhead_guide",
      "url": "https://www.wowhead.com/tbc/guide/feral-druid-tank-za-phase-4-best-in-slot-gear-burning-crusade"
    },
    {
      "class": "Druid",
      "content_terminology": "wowhead_classic",
      "data_family": "bis_lists",
      "fetched_at": null,
      "id": "bis-lists-druid-feral-tank-swp",
      "phase": "SWP",
      "spec": "Feral tank",
      "status": "ready_full_bis",
      "type": "wowhead_guide",
      "url": "https://www.wowhead.com/tbc/guide/feral-druid-tank-swp-phase-5-best-in-slot-gear-burning-crusade"
    },
    {
      "class": "Druid",
      "content_phases": [
        "PR",
        "T4",
        "T5",
        "T6",
        "ZA",
        "SWP"
      ],
      "content_terminology": "anniversary_2026",
      "data_family": "bis_lists",
      "fetched_at": null,
      "id": "bis-lists-druid-feral-dps-pr",
      "inheritance_policy": "nearest_earlier_verified",
      "phase": "PR",
      "spec": "Feral dps",
      "status": "ready_full_bis",
      "type": "wowhead_guide",
      "url": "https://www.wowhead.com/tbc/guide/classes/druid/feral/dps-bis-gear-pve-pre-raid"
    },
    {
      "class": "Druid",
      "content_terminology": "wowhead_classic",
      "data_family": "bis_lists",
      "fetched_at": null,
      "id": "bis-lists-druid-feral-dps-t4",
      "phase": "T4",
      "spec": "Feral dps",
      "status": "ready_full_bis",
      "type": "wowhead_guide",
      "url": "https://www.wowhead.com/tbc/guide/feral-druid-dps-karazhan-best-in-slot-gear-burning-crusade-classic-wow"
    },
    {
      "class": "Druid",
      "content_terminology": "anniversary_2026",
      "data_family": "bis_lists",
      "fetched_at": null,
      "id": "bis-lists-druid-feral-dps-t5",
      "phase": "T5",
      "spec": "Feral dps",
      "status": "ready_full_bis",
      "type": "wowhead_guide",
      "url": "https://www.wowhead.com/tbc/guide/classes/druid/feral/dps-bis-gear-pve-phase-2"
    },
    {
      "class": "Druid",
      "content_terminology": "wowhead_classic",
      "data_family": "bis_lists",
      "fetched_at": null,
      "id": "bis-lists-druid-feral-dps-t6",
      "phase": "T6",
      "spec": "Feral dps",
      "status": "ready_full_bis",
      "type": "wowhead_guide",
      "url": "https://www.wowhead.com/tbc/guide/feral-druid-dps-bt-hyjal-phase-3-best-in-slot-gear-burning-crusade"
    },
    {
      "class": "Druid",
      "content_terminology": "wowhead_classic",
      "data_family": "bis_lists",
      "fetched_at": null,
      "id": "bis-lists-druid-feral-dps-za",
      "phase": "ZA",
      "spec": "Feral dps",
      "status": "ready_full_bis",
      "type": "wowhead_guide",
      "url": "https://www.wowhead.com/tbc/guide/feral-druid-dps-za-phase-4-best-in-slot-gear-burning-crusade"
    },
    {
      "class": "Druid",
      "content_terminology": "wowhead_classic",
      "data_family": "bis_lists",
      "fetched_at": null,
      "id": "bis-lists-druid-feral-dps-swp",
      "phase": "SWP",
      "spec": "Feral dps",
      "status": "ready_full_bis",
      "type": "wowhead_guide",
      "url": "https://www.wowhead.com/tbc/guide/feral-druid-dps-swp-phase-5-best-in-slot-gear-burning-crusade"
    },
    {
      "class": "Druid",
      "content_phases": [
        "PR",
        "T4",
        "T5",
        "T6",
        "ZA",
        "SWP"
      ],
      "content_terminology": "anniversary_2026",
      "data_family": "bis_lists",
      "fetched_at": null,
      "id": "bis-lists-druid-restoration-pr",
      "inheritance_policy": "nearest_earlier_verified",
      "phase": "PR",
      "spec": "Restoration",
      "status": "ready_full_bis",
      "type": "wowhead_guide",
      "url": "https://www.wowhead.com/tbc/guide/classes/druid/healer-bis-gear-pve-pre-raid"
    },
    {
      "class": "Druid",
      "content_terminology": "wowhead_classic",
      "data_family": "bis_lists",
      "fetched_at": null,
      "id": "bis-lists-druid-restoration-t4",
      "phase": "T4",
      "spec": "Restoration",
      "status": "ready_full_bis",
      "type": "wowhead_guide",
      "url": "https://www.wowhead.com/tbc/guide/druid-healer-karazhan-best-in-slot-gear-burning-crusade-classic-wow"
    },
    {
      "class": "Druid",